"text","language","style"
"（三）出租人应当注意留存房屋租赁前后的对比照片，仔细填写房屋交割单，以便双方当事人确认租赁前后房屋的状态。","ch","law"
"变更执行承包人收到工程师下达的变更指示后，认为不能执行，应在合理期限内提出不能执行该变更指示的理由。","ch","law"
"10.2.2 发包人在全部工程竣工前，使用已接收的单位 / 区段工程导致承包人费用增加的， 发包人应承担由此增加的费用和（或）工期延误，并支付承包人合理利润。","ch","law"
"系共犯。 公诉机关指控的事实清楚， 证据确实充分， 本院予以支持。 在共同犯罪中， 代宝建和宋廷杰的作用基本相当，","ch","law"
"联合体经发包人同意，以联合体方式承包工程的，联合体各方应共同与发包人订立合同协议书。","ch","law"
"且主动赔偿被害人家属部分经济损失。 经核查， 辩护人的辩护意见与查明的事实相符， 本院予以采纳本院认为，","ch","law"
"承包人完成工程师通知的全部工作内容后，应再次提交竣工验收申请报告，直至工程师同意为止。","ch","law"
"（二）数据中介服务： 是指依据合同约定，中介方向委托方提供的市场推广、客户对接、合同订立等交易撮合活动。","ch","law"
"责任承担承包人对分包人的行为向发包人负责，承包人和分包人就分包工作向发包人承担连带责任。","ch","law"
"后来我俩一直说好话， 说给他做饭吃， 他才把我俩松开， 我就从炕上下来给他找的衣服穿， 然后他就把刀别在腰上了，","ch","law"
"建议判处被告人拘役一个月至二个月， 并处罚金2000元。 被告人周羊超对指控事实、罪名及量刑建议没有异议且签字具结。","ch","law"
"在双方未出现违约的情况下，委托人留学申请成功，但因委托人原因造成签证申请被拒签的，受托人不退还任何费用。","ch","law"
"上海市奉贤区物价局出具的价格鉴定结论书， 华东政法大学司法鉴定中心司法鉴定意见书， 公安机关制作并出具的辨认笔录、案发经过、扣押决定书、扣押笔录、扣押及发还清单，","ch","law"
"警察赶到现场后才得以制止。 被填土损毁的基桩坑共27个， 经洛阳市价格认定中心认定， 总价格共5400元。","ch","law"
"随即周洪元打电话给被告人谢某， 李某打电话给其朋友黄某乙、朱某等人。 当日22时30分许， 双方在金沙县经济开发区Ｂ区门口相遇并发生殴打，","ch","law"
"证实案发地的方位、概貌及被劫现场状况， 公安机关将现场遗留的烟蒂、食用过的方便面包装盒予以提取。","ch","law"
"七、名词解释： （一）标的数据： 是指本合同约定的中介服务对应的一系列数据。","ch","law"
"5.有下列情形之一的，甲方有权单方解除本合同： （1）乙方违反合同约定造成标的数据的重大泄露或滥用事件的。","ch","law"
"停车场管理方还应当向停车人出示车位合法权属证明或来源证明。 4.本合同文本“【】”“□”中选择内容及其他需要删除或添加的内容，双方当事人应当协商确定，以划“√”方式选定；对于实际情况未发生或双方当事人不作约定的，应当在空格部位打“×”，以示删除。","ch","law"
"系共同犯罪。 三被告人具有坦白的法定从轻处罚情节， 依法均可从轻处罚；同时考虑三被告人自愿缴纳渔业资源修复费，","ch","law"
"任何一方当事人不接受争议评审小组的决定，并不影响暂时执行争议评审小组的决定，直到在后续的采用其他争议解决方式中对争议评审小组的决定进行了改变。","ch","law"
"（ 5）承包人应采取有效措施预防传染病，保持食堂的饮食卫生，保证施工人员的健康，并定期对施工现场、施工人员生活基地和工程进行防疫和卫生的专业检查和处理 , 在远离城镇的施工现场，还应配备必要的伤病防治和急救的医务人员与医疗设施。","ch","law"
"（ 3）承包人对发包人颁发的最终结清证书有异议的，按第 20 条 [ 争议解决 ] 的约定办理。","ch","law"
"本院于当日立案， 依法组成由审判员邓元元担任审判长， 与人民陪审员高娥秀、彭扬帆参加评议的合议庭，","ch","law"
"统一社会信用代码： 民非登记证 / 营业执照有效期： 年 月 日联系人： 联系电话：","ch","law"
"其中一名同事控制了张某， 我冲到二楼进入了田智鑫的房间， 和随后进入的同事将田智鑫和郭某、李某1三人控制，","ch","law"
"住所地成都高新区孵化园科技财富中心5号楼2楼）项目负责人赵春旭（另案处理）提供帮助， 使环宇公司顺利入围通建公司劳务分包商名单，","ch","law"
"（四）甲方未按照约定交付有关标的物的单证和资料的，不影响标的物毁损、灭失风险的转移。","ch","law"
"因被执行人陆永权之妻孙培荣不配合， 裁定未能执行。 自诉人刘某认为被告人陆永权行为构成拒不执行判决、裁定罪，","ch","law"
"经政府有关部门责令支付后仍不支付；在道路上醉酒驾驶机动车， 其行为已构成拒不支付劳动报酬罪、危险驾驶罪，","ch","law"
"承包人应遵守第 6.6.1 项下指示，并在合理可行的情况下，根据上述指示中规定的时间完成修补工作。","ch","law"
"除专用合同条件另有约定外，最终结清申请单应列明质量保证金、应扣除的质量保证金、缺陷责任期内发生的增减费用。","ch","law"
"刘某6先在小级别组工作， 又转到大级别组工作， 大级别组主管是王某1， 客服人员有梁某1， 毛某、郭某等人。","ch","law"
"工程师的指示应采用书面形式，盖有工程师授权的项目管理机构章，并由工程师的授权人员签字。","ch","law"
"甲方（签名/盖章）： 乙方（签名/盖章）： 法定代表人： 法定代表人： 委托代理人： 委托代理人：","ch","law"
"竣工后试验的结果应由双方进行整理和评价，并应适当考虑发包人对工程或其任何部分的使用，对工程或区段工程的性能、特性和试验结果产生的影响。","ch","law"
"上述临时使用的水、电等的类别、取费单价在专用合同条件中约定，发包人按实际计量结果收费。","ch","law"
"（ 2）承包人每次报送样品时应随附申报单，申报单应载明报送样品的相关数据和资料，并标明每件样品对应的图纸号，预留工程师审批意见栏。","ch","law"
"不予采纳。 综上， 根据被告人犯罪的事实、犯罪的性质、情节、认罪态度和对于社会的危害程度， 依照《中华人民共和国刑法》第一百一十四条、第六十七条第一款、第六十一条，","ch","law"
"于2017年11月23日向本院提起公诉。 本院受理后， 依法组成合议庭， 适用简易程序， 公开开庭审理了本案。 上海市静安区人民检察院指派检察员王某出庭支持公诉。","ch","law"
"二、合同签订前，双方当事人应当仔细阅读本合同内容，特别是其中具有选择性、补充性、填充性、修改性的内容，注意防范交易风险。","ch","law"
"本院审查受理后， 依法组成合议庭， 公开开庭审理了本案。 固始县人民检察院指派检察员罗明海出庭支持公诉，","ch","law"
"但是以下情况除外： 。 第三条 甲乙双方义务1.甲方确保其使用数据的行为不侵害乙方或任何第三方的合法权益。","ch","law"
"报警案登记表、立案决定书、抓获经过、户籍资料等书证；证人郑某的陈述；被告人李晓亮的供述与辩解；提取笔录、扣押决定书、扣押物品清单及照片；鉴定意见等。","ch","law"
"工程师指示撤换不能按照合同约定履行职责及义务的主要施工管理人员的，承包人应当撤换。","ch","law"
"因承包人原因导致工期延长的，继续提供履约担保所增加的费用由承包人承担；非因承包人原因导致工期延长的，继续提供履约担保所增加的费用由发包人承担。","ch","law"
"二、《示范文本》的适用范围《示范文本》适用于房屋建筑和市政基础设施项目工程总承包承发包活动。","ch","law"
"被告人李某在上述工作室内以人民币920元的价格向赵香玉出售金色盒装“Ｎｅｕｒａｍｉｓ”玻尿酸2支、黑色盒装“Ｎｅｕｒａｍｉｓ”玻尿酸2支。","ch","law"
"后公安民警在该宾馆一楼大厅将被告人李艾琪抓获， 并现场查获其随身携带的透明塑料袋装晶体颗粒毒品1包。","ch","law"
"事后， 被告人练某某驾驶盗窃得来的摩托车到县城一间二手摩托车店， 以400元的价格把摩托车卖给该摩托车店。","ch","law"
"本院予以支持。 被告人沈伍来归案后如实供述主要犯罪事实， 依法可从轻处罚。 辩护人所提的辩护意见，","ch","law"
"说是照顾其， 给其多弄了几亩退耕还林的补助；证人张某丙证言证实， 张某甲是其父亲， 其没有享受退耕还林补助的土地，","ch","law"
"合同文件的优先顺序组成合同的各项文件应互相解释，互为说明。 除专用合同条件另有约定外，解释合同文件的优先顺序如下：","ch","law"
"（ 3）乙方或乙方监护人隐瞒重要乙方健康状况、患有须隔离治疗的传染性疾病或者患有精神疾病等其他不适宜在机构内集中生活的。","ch","law"
"八、线上培训机构不得提供和传播“拍照搜题”等惰化学生思维能力、影响学生独立思考、违背教育教学规律的不良学习方法。","ch","law"
"一方泄露或者在本合同以外使用该商业秘密、技术秘密等保密信息给另一方造成损失的， 应承担损害赔偿责任。","ch","law"
"4.各方因自身业务使用结果数据产生的与第三方的纠纷，由其自行与第三方解决。","ch","law"
"是犯罪未遂， 可减轻处罚；主动投案并供述了主要犯罪事实， 是自首， 可减轻处罚；自愿认罪、认罚， 可酌情从轻处罚，","ch","law"
"（5）视听资料、电子数据， 证明公安机关从红桃Ｋ网络赌博俱乐部扣押的电脑内恢复的数据、ＨＴＫ财务云盘下载数据和本案银行流水数据。","ch","law"
"乙方（签名/盖章）： 法定代表人： 法定代表人： 委托代理人： 委托代理人： 年 月 日 年 月 日","ch","law"
"。 由此造成乙方人身或财产损失的，甲方还应承担赔偿责任。 甲方或其工作人员侵犯乙方、乙方监护人及丙方对甲方提供的养老服务的知情权的， 乙方、乙方监护人和丙方有权要求甲方改正，造成损失的甲方应承担赔偿责任。","ch","law"
"证件类型： 【居民身份证】【 】证件号码： 通讯地址： 邮编： 电子邮箱： 联系电话： 依据《中华人民共和国民法典》《北京市机动车停车条例》等有关法律法规的规定，甲乙双方在自愿、公平和诚信的基础上，就错时停车位租赁的有关事宜达成如下协议：","ch","law"
"预付款担保可采用银行保函、担保公司担保等形式，具体由合同当事人在专用合同条件中约定。","ch","law"
"被告人王永进供述全部犯罪事实属于在追诉前供述， 但办案机关是在韦某和主动供述除25000元外的全部犯罪事实后，","ch","law"
"（四）质量标准。 （五）设计、施工和设备监造、试验（如有）。 （六）样品。 （七）发包人提供的其他条件，如发包人或其委托的第三人提供的设计、工艺包、用于试验检验的工器具等，以及据此对承包人提出的予以配套的要求。","ch","law"
"10.3 甲方与乙方监护人或丙方联系中断因乙方监护人或丙方提供的联系地址、方式不准确或不详细或变更后未及时通知甲方，或其他客观原因致使甲方无法与乙方监护人或丙方及时联系，此种情况连续达一个月则视为联系中断。","ch","law"
"（八）乙方保证接触、管理危险化学品人员有相关资质，并在认真阅读化学品安全技术说明书后接触危险化学品。","ch","law"
"证实被告人蔡某某血液中乙醇含量为129.28毫克／100毫升；4.行政处罚决定书、交通管理行政强制措施凭证， 证实盐池县公安局依法吊销被告人蔡某某机动车驾驶证；5.车辆照片，","ch","law"
"本院受理后， 依法组成合议庭， 于2018年8月1日公开开庭审理了本案。 涞水县人民检察院指派检察员雷建军、孙莎出庭支持公诉，","ch","law"
"自己找孔某甲联系ＸＸＸ村小学工程时， 向孔某甲许诺“如果赚了钱过后不会忘记你”。 他说“行， 你愿意干， 你就找肖镇长吧”。","ch","law"
"除专用合同条件另有约定外，预付款在进度付款中同比例扣回。 在颁发工程接收证书前， 提前解除合同的，尚未扣完的预付款应与合同价款一并结算。","ch","law"
"甲方与乙方或乙方监护人协商后，可以重新确定联系人。 非因甲方原因造成乙方人身、财产损害的，甲方不承担责任。","ch","law"
"九、本合同编号由县级以上农业农村部门或农村经营管理部门指导乡（镇）人民政府农村土地承包管理部门按统一规则填写。","ch","law"
"与乙方关系： 居民身份号码： 家庭住址： 联系电话： 电子邮箱： 丙方丙方作为入住老人的：","ch","law"
"（ 1）付款计划表中所列的每期付款金额，应为第 14.3.1 项 [ 工程进度付款申请 ] 每期进度款的估算金额；（ 2）实际进度与项目进度计划不一致的，合同当事人可按照第 3.6 款 [ 商定或确定 ] 修改付款计划表；（ 3）不采用付款计划表的，承包人应向工程师提交按季度编制的支付估算付款计划表，用于支付参考。","ch","law"
"施工设备和临时设施承包人提供的施工设备和临时设施承包人应按项目进度计划的要求，及时配置施工设备和修建临时设施。","ch","law"
"同时发包人有权根据第 16.1 款 [ 由发包人解除合同 ] 的约定解除合同。 第 10 条	验收和工程接收竣工验收竣工验收条件工程具备以下条件的，承包人可以申请竣工验收：","ch","law"
"合同当事人可以在专用合同条件中约定异常恶劣的气候条件的具体情形。","ch","law"
"本院依法适用简易程序， 实行独任审判， 公开开庭审理了本案。 西安市莲湖区人民检察院指派代理检察员何菲出庭支持公诉，","ch","law"
"通过本院或直接向凉山彝族自治州中级人民法院提出上诉， 书面上诉的应交上诉状正本一份， 副本两份审判长李红审判员李国英人民陪审员阿都尔也二〇一八年七月二十五日书记员安雅琳","ch","law"
"判决如下： 被告人王晓华犯妨害公务罪， 判处有期徒刑九个月， 缓刑一年。 （缓刑考验期限， 从判决确定之日起计算。","ch","law"
"退耕还林相关政策情况；宽城满族自治县退耕还林办公室关于孟子岭乡南天门村退耕还林部分小班实地位置的说明证实，","ch","law"
"（二）由于甲方的原因，包括但不限于甲方办学许可证过期，被吊销办学许可证、营业执照（或事业单位法人证书、民办非企业单位登记证书），被责令停业整顿、撤销登记等原因，无法继续向乙方提供培训服务的，乙方有权要求解除合同，要求甲方退还剩余培训费并支付剩余培训费 [	]% 金额的违约金。","ch","law"
"承包人擅自更换工程总承包项目经理的，应按照专用合同条件的约定承担违约责任。","ch","law"
"第一条 车位基本信息1.车位来源： □自有 □租赁（租赁期限： ）2.车位位置为： 北京市 区 （应与车位合法权属证明或来源证明记载的坐落一致），该车位所在地的街道办事处（乡镇）为：","ch","law"
"具有法定从轻或减轻处罚情节；被告人郭杰案发后积极赔偿被害人， 取得被害人的谅解， 具有酌定从轻处罚情节。","ch","law"
"民警遂在被告人胡江与被害人律九州约定见面的地点将其挡获。 公诉机关认为， 被告人胡江的行为构成诈骗罪，","ch","law"
"延误的试验如果承包人已根据第 9.1 款 [ 竣工试验的义务 ] 就可以开始进行各项竣工试验的日期通知工程师，但该等试验因发包人原因被延误 14 天以上的，发包人应承担由此增加的费用和工期延误，并支付承包人合理利润。","ch","law"
"（ 3）承包人应向工程师提交试验人员的名单及其岗位、资格等证明资料，试验人员必须能够熟练进行相应的检测试验，承包人对试验人员的试验程序和试验结果的正确性负责。","ch","law"
"二、被害人报案材料和陈述被害人荆某某的报案材料和陈述笔录， 证实被告人陈某做生意向其借钱，","ch","law"
"（1）乙方擅自改变该房屋用途或者利用该房屋从事违法违规活动的；（2）乙方擅自变动该房屋建筑主体和承重结构的；（3）乙方擅自改建、扩建、装饰装修该房屋或者变更该房屋的附属设施、物品，经甲方要求，在 日内未恢复原状的；8.其他 。","ch","law"
"承包人未建议重新试验的，发包人也可在缺陷修补后的 14 天内指示进行必要的重新试验，以证明已修复的部分符合合同要求。","ch","law"
"2.协商或调解不成的，按照以下第 种方式解决： （1）向 人民法院起诉。 （2）向 仲裁委员会申请仲裁。","ch","law"
"乙方有权要求甲方提供危险化学品的包装、储存、标签、使用、危险处理信息。","ch","law"
"二、本合同所称二手车，是指从办理完注册登记手续到达到国家强制报废标准之前进行交易并转移所有权的汽车（包括三轮汽车、低速载货汽车，即原农用运输车）、挂车和摩托车。","ch","law"
"书面上诉的， 应当提交上诉状正本一份， 副本二份审判员张泽辉二Ｏ一九年七月十九日书记员舒涛","ch","law"
"未能修复因承包人原因造成工程的缺陷或损坏，承包人拒绝维修或未能在合理期限内修复缺陷或损坏，且经发包人书面催告后仍未修复的，发包人有权自行修复或委托第三方修复，所需费用由承包人承担。","ch","law"
"乙方的义务6.3.1 如实告知甲方本人的健康状况、药品使用情况等信息，并如实填写《健康状况自我陈述书》。","ch","law"
"判决如下一、被告人茅佶成犯信用卡诈骗罪， 判处有期徒刑七年， 并处罚金人民币十万元；（刑期从判决执行之日起计算。","ch","law"
"样品的报送程序如下： （ 1）承包人应在计划采购前 28 天向工程师报送样品。 承包人报送的样品均应来自供应材料的实际生产地，且提供的样品的规格、数量足以表明材料或工程设备的质量、型号、颜色、表面处理、质地、误差和其他要求的特征。","ch","law"
"（四）数据持有权： 是指权利人自行持有或委托他人代为持有合法获取的数据的权利。","ch","law"
"二、对买受人的提示（一）危险化学品具有一定的危害性，买受人应当增强对危险化学品交易、使用风险的了解和认知，应当配合出卖人查验其购买资质。","ch","law"
"利用其参与被征迁房屋丈量的职务便利， 于2008年7、8月份的一天， 在其家中收受被征迁户王某乙所送人民币10000元。","ch","law"
"3.服务期限内，甲方□是□否可以委托其他中介人提供内容相同或者相近的中介服务，并且及时将相关信息告知乙方。","ch","law"
"。 三、出租土地用途出租土地用途为 	。 四、租赁期限租赁期限自 	年 	月 	日起至 	年 	月 	日止。","ch","law"
"合同编号： 危险化学品生产经营企业自建网站销售合同（示范文本）甲方（出卖人）：","ch","law"
"单位 / 区段工程的验收发包人根据项目进度计划安排，在全部工程竣工前需要使用已经竣工的单位 / 区段工程时，或承包人提出经发包人同意时，可进行单位 / 区段工程验收。","ch","law"
"他们去派出所报案， 通过查信用社监控发现是张某1取的钱。 （3）证人张某3的证言， 证实张某1为其长子。 其跟他人在村里看水库，","ch","law"
"停车人是指满足以下条件之一并向停车场管理方承租错时停车位的自然人。","ch","law"
"第八条	合同的生效本合同一式 	份，经双方当事人签字或盖章之日起生效。","ch","law"
"我跟随民警雷某从该民居瓦房的西面翻墙进入房内， 左脚不慎踩中了一个铁制的山猪夹， 左脚被夹后很痛。","ch","law"
"如果内容变动的，应履行书面通知义务，否则双方所确认的送达地址及联系方式仍视为有效。","ch","law"
"常州市公安局钟楼分局在被告人马艳住宿的本市钟楼区中吴大道1803号徽熳国际大酒店1002号房间查获尚未销售的无药品批准文号的“ＨＵＴＯＸ”肉毒素5支、“ＮｅｕｒａｍｉｓＤＥＥＰ”（黑色盒包装）玻尿酸5支、“Ｎｅｕｒａｍｉｓ”（黄色盒包装）玻尿酸1支，","ch","law"
"第十条 保密要求各方对订立合同过程中知悉的对方的商业秘密（包括技术信息和经营信息）及各方约定的其他保密信息，如 ，无论本合同是否成立，均不得泄露或者不正当使用，直至相关信息经合法渠道成为公开信息。","ch","law"
"在工程实施过程中，如遇到突发的地质变动、事先未知的地下施工障碍等影响施工安全的紧急情况，承包人应及时报告工程师和发包人，发包人应当及时下令停工并采取应急措施，按照相关法律法规的要求需上报政府有关行政管理部门的，应依法上报。","ch","law"
"承包人建议书： 指构成合同文件组成部分的名为承包人建议书的文件。 承包人建议书由承包人随投标函一起提交。","ch","law"
"其一伙先抢走龚某某身上3700元现金， 后又逼迫龚某某交出银行卡及密码。 尔后， 官某到沙洋联社长林分社自动柜员机分10次取走现金20000元。","ch","law"
"承包人应在发包人指示中说明的日期或与发包人达成一致的其他日期开展调查。","ch","law"
"证人黄某、林某、李某、薛某、余某、汪某、翁某等人的证言、抓获经过；3、被害人陈述： 被害人纪某的陈述；4、被告人的供述：","ch","law"
"甲方的指定数据接收人为 （姓名/职位）。 第六条 费用支付1.费用计算（含税）： 甲乙双方确认按照以下第 种方式计算费用。","ch","law"
"公安机关将陈某抓获。 上述事实有公诉机关当庭出示或宣读的下列证据予以证实： 物证、书证： （1）名片、被告人身份资料（2）虚假的深圳市超卓工程有限公司内部零星承包施工协议书。","ch","law"
"乙方签字（盖章）： 住 所： 营业地址： 甲方代表： 乙方代表（经办人）： 联系电话： 联系电话：","ch","law"
"每次培训课程结束后，甲方应确保学员被乙方安全接走，双方另有约定的除外。","ch","law"
"。 第四条	中介服务费用双方协商确定，委托人申请的留学院校在本合同附件一《院校及专业确认表》范围以内， 中介服务费为人民币（大写）	元整（￥ 	）；委托人申请的留 学院校超出《院校及专业确认表》范围，每增加一所学校，委托人须另缴纳中介服务费人民币（大写）	元整（￥ 	）。","ch","law"
"如未在 28 天内发出上述通知的，工程师的确定应被视为已被双方接受并对双方具有约束力，但专用合同条件另有约定的除外。","ch","law"
"法律适用于合同的其他规范性文件： 。 标准和规范适用于本合同的标准、规范（名称）包括：","ch","law"
"称高某甲和高某乙是其孙女， 同村的凃尚俊平时喜欢带小孩玩， 经常给零食， 小孩也喜欢到他家玩。","ch","law"
"第十八条 通知、送达（一）双方保证在本合同中记载的联系电话、联系地址、电子邮箱等信息均真实有效并作为本合同履行以及法院或者仲裁机构解决本合同争议时的有效联系方式和送达地址。","ch","law"
"甲方提供的服务设施除了住宿的房屋，还包括房间内设施及公共设施，具体明细见本合同附件《设施设备清单》。","ch","law"
"。 场内交通关于场内交通的特别约定： 。 关于场内交通与场外交通边界的约定：","ch","law"
"以上， 被告人廖林华在岐岭乡新村村烟基工程项目中， 利用其职务便利， 侵占新村村集体资金共计247100元。","ch","law"
"如果根据乙方健康状况的变化，不调整服务项目将导致乙方的健康安全无法保障的，甲方提出变更的服务方案后，乙方（乙方监护人）和丙方既不同意，也不接受实际服务，甲方与乙方（乙方监护人）和丙方均有权解除本合同。","ch","law"
